"大","名称(大)","中","名称(中)","小","名称(小)","細","名称(細)","該当例"
"","","","","359","その他の家庭生活支援サービスの職業","359-01","ベビーシッター","チャイルドシッター、乳幼児シッター、乳幼児世話人（個人家庭）"
"","","","","","","359-99","他に分類されない家庭生活支援サービスの職業","洗たく人（個人家庭）、料理人（個人家庭）"
"","","36","施設介護員","361","施設介護員","361-01","施設介護員","ケアワーカー（医療施設、老人福祉施設）、介護サービス員（老人保健施設）"
"","","","","362","訪問介護職","362-01","訪問介護員","在宅介護員、在宅ケアワーカー、訪問介護サービス員、ホームヘルパー"
"","","","","","","362-02","訪問入浴介助員","在宅入浴介助員、在宅入浴サービス員、訪問入浴サービス員、訪問入浴ヘルパー"
"","","37","保健医療サービスの職業","371","看護助手","371-01","看護助手","看護アシスタント、看護ヘルパー、看護補助者"
"","","","","372","歯科助手","372-01","歯科助手","歯科アシスタント、歯科補助者"
"","","","","379","その他の保健医療サービスの職業","379-01","動物病院助手","アニマルヘルステクニシャン、獣医補助者、動物衛生看護士、動物病院アシスタント、動物病院看護補助者"
"","","","","","","379-99","他に分類されない保健医療サービスの職業","検眼助手、調剤助手、リハビリ助手"
"","","38","生活衛生サービスの職業","381","理容師","381-01","理容師","管理理容師、床屋、理髪師"
"","","","","382","美容師","382-01","美容師","髪結師、管理美容師、スタイリスト（美容師）、メークアップアーティスト"
"","","","","383","美容サービス職","383-01","着付師","衣装着付師"
"","","","","","","383-02","エステティシャン","美顔術師"
"","","","","","","383-03","ネイリスト","ネイル・アーティスト、ペディキュア師、マニキュア師"
"","","","","","","383-99","他に分類されない美容サービス職","かつら結髪師、床山、ヘアメイク係（美容師ではないもの）"
"","","","","384","浴場従事人","384-01","浴場従事人","温泉浴場従事人、サウナ支配人（主に浴場業務に従事するもの）、銭湯経営者（主に浴場業務に従事するもの）、番台、ヘルスセンター浴場従事人、浴場清掃員"
"","","","","385","クリーニング職","385-01","クリーニング工 ","貸おしぼり洗たく工、クリーニング師、しみ抜き工、洗たく工、ドライクリーニング工、リネンサプライ業従事者（洗たくに従事するもの）"
"","","","","","","385-02","クリーニング仕上工","アイロン仕上工（クリーニング）、クリーニングプレス工、洗たく整理工、洗たくプレス工、リネンサプライ業従事者（洗たくの仕上げに従事するもの）"
"","","","","389","その他の生活衛生サービスの職業","389-01","洗張職","洗張工、湯のし工"
"","","","","","","389-97","理容師・美容師補助者","美容師アシスタント、美容師補助者、理容師アシスタント、理容師補助者"
"","","39","飲食物調理の職業","391","調理人","391-01","日本料理調理人","板前、うどん料理人、そば料理人、天ぷら揚げ職人（飲食店）、ふぐ調理師、和食調理人"
"","","","","","","391-02","すし職人","すし職人（回転すし）、にぎりずし職人（飲食店）"
"","","","","","","391-03","西洋料理調理人","イタリア料理調理人、コック、シェフ、パティシエ（飲食店）、フランス料理調理人、洋食調理人"
"","","","","","","391-04","中華料理調理人","中国料理調理人、ラーメン調理人"
"","","","","","","391-05","給食調理人","機内食製造工、給食係員、給食センター調理人、社員食堂調理人、調理人（病院）"
"","","","","","","391-97","調理補助者","調理助手、調理手伝人"
"","","","","","","391-98","調理人見習","すし職人（見習）、西洋料理調理人（見習）、中華料理調理人（見習）、日本料理調理人（見習）"
"","","","","","","391-99","他に分類されない調理人","居酒屋調理人、喫茶店調理人、漁船司厨員、出張料理調理人、大衆食堂調理人、持ち帰り弁当調理人"
"","","","","392","バーテンダー","392-01","バーテンダー","バーテン、バーテンダー見習"
"","","40","接客・給仕の職業","401","飲食店主・店長","401-01","レストラン店長","ファミリーレストラン店長（主に接客の仕事に従事するもの）、レストラン店長（主に接客の仕事に従事するもの）"
"","","","","","","401-99","他に分類されない飲食店主・店長","居酒屋店長（主に接客の仕事に従事するもの）、ハンバーガー店マネージャー（主に接客の仕事に従事するもの）"
"","","","","402","旅館・ホテル支配人","402-01","旅館・ホテル支配人","番頭（旅館）、ペンション経営者（主に接客の仕事に従事するもの）、ホテル支配人（主に接客の仕事に従事するもの）、旅館支配人（主に接客の仕事に従事するもの）、旅館主（主に接客の仕事に従事するもの）"
"","","","","403","飲食物給仕係","403-01","配ぜん人","ウエイター（宴会場）、ウエイトレス（宴会場）、配ぜん係"
"","","","","","","403-02","ウエイター・ウエイトレス（飲食店ホール係）","ウエイター（飲食店）、ウエイトレス（飲食店）、フロア係（飲食店）、フロアスタッフ（飲食店）、ホール係（飲食店）、ホールスタッフ（飲食店）"
"","","","","","","403-03","ソムリエ","ソムリエール"
"","","","","404","旅館・ホテル・乗物接客員","404-01","旅館・ホテルフロント係","ホテルフロント係、予約係（ホテル）、予約係（旅館）、旅館フロント係"
"","","","","","","404-02","旅館・ホテル接客係","接客係（ホテル）、接客係（旅館）、ドアマン、ベルパーソン、ベルボーイ・ベルガール、ホテル案内係、ホテルサービス係、旅館案内係、旅館サービス係"
"","","","","","","404-03","旅館・ホテル客室係","客室係（ホテル）、客室係（旅館）、仲居、ハウスキーパー（客室係）、ベッドメーク係、ルーム係"
"","","","","","","404-04","乗物客室係","キャビンアテンダント、航空客室乗務員、スチュワーデス、スチュワード、船室係、船舶旅客係、フライトアテンダント"
"","","","","405","接客社交係、芸者、ダンサー","405-01","接客社交係","コンパニオン（バー）、コンパニオン（クラブ）、接客係（バー）、接客係（クラブ）、ホステス、ホスト"
"","","","","","","405-02","芸者、ダンサー","芸妓、フロアダンサー、舞妓"
"","","","","406","娯楽場等接客員","406-01","娯楽場等支配人","映画館支配人（主に接客の仕事に従事するもの）、ゲームセンター管理人（主に接客の仕事に従事するもの）、ゴルフ場支配人（主に接客の仕事に従事するもの）、パチンコ店支配人（主に接客の仕事に従事するもの）"
"","","","","","","406-02","娯楽場等接客係","インフォメーション係（娯楽場）、カウンター係（娯楽場）、景品交換係（パチンコ店）、娯楽場出・改札係、娯楽場放送係、座席案内係（娯楽場）、接客係（娯楽場）、入場券販売係（娯楽場）、フロント係（娯楽場）"
"","","","","","","406-03","娯楽場等遊戯施設係","アトラクション係（遊戯施設）、貸遊具係、ゲームセンター機械係、乗物運転操作員（遊園地）、ホール係（パチンコ店）、遊園地施設係、遊戯機械係、遊戯施設係、遊戯装置係、遊具オペレーター"
"","","","","","","406-04","スポーツ施設係","キャディマスター、ゴルフ場係員、ゴルフ場フロント係、スポーツクラブ係員、スポーツ・クラブハウス係、スポーツセンター係員、スポーツ用具貸出係、テニス場係員、フィットネスクラブ係員、フロント係（ゴルフ場）"
"","","","","","","406-05","キャディ","ハウスキャディ"
"","","","","409","その他の接客・給仕の職業","409-99","その他の接客・給仕の職業","案内係（百貨店）、接客係（百貨店）"
"","","41","居住施設・ビル等の管理の職業","411","マンション・アパート・下宿管理人","411-01","マンション・アパート・下宿管理人","アパート管理人、下宿管理人、住宅施設管理人、住込管理人（マンション）、フロント係（マンション）、マンション管理人"
"","","","","412","寄宿舎・寮管理人","412-01","寄宿舎・寮管理人","合宿所管理人、寄宿舎管理人、寄宿舎世話係、舎監、社宅管理人、住込管理人（寄宿舎・寮）、世帯寮管理人、独身寮管理人、寮管理人"
"","","","","413","ビル管理人","413-01","ビル管理人","ビル管理員"
"","","","","414","駐車場・駐輪場管理人","414-01","駐車場・駐輪場管理人","駐車場係、駐車場管理人、駐車場誘導員、駐輪場管理人、パーキングメーター管理人"
"","","","","419","その他の居住施設・ビル等の管理の職業","419-01","別荘管理人","貸別荘管理人"
"","","","","","","419-99","他に分類されない居住施設・ビル等の管理の職業","公民館管理人、スポーツ競技場管理人、体育館管理人、託児所管理人"
"","","42","その他のサービスの職業","421","添乗員、観光案内人","421-01","添乗員","ツアーエスコート、ツアーコンダクター、旅行添乗員"
"","","","","","","421-02","観光案内人","アルパインガイド、観光通訳案内人、通訳案内士、通訳ガイド、登山案内人、トラベルガイド、名所・旧跡案内人、旅行・観光案内人、旅行・観光ガイド"
"","","","","422","物品一時預り人","422-01","物品一時預り人","クローク係、コインロッカー管理人、手荷物一時預り人"
"","","","","423","物品賃貸人","423-01","物品賃貸人","貸衣装人、自転車賃貸人、レンタルショップ店員、レンタカー営業所員"
"","","","","424","広告宣伝人","424-01","広告宣伝員","キャンペーン宣伝員、コマーシャルモデル、イベントコンパニオン、ショールーム員、ファッションモデル"
"","","","","","","424-02","チラシ配布員","ビラ配り人、ポスティング人"
"","","","","425","葬儀師、火葬係","425-01","葬儀師","葬儀セレモニー準備人、葬儀店員、葬祭飾付人、葬祭ディレクター、湯灌師"
"","","","","","","425-02","火葬係","火葬作業員、火葬場現業員"
"","","","","426","トリマー","426-01","トリマー","グルーマー"
"","","","","429","他に分類されないサービスの職業","429-01","ポーター","手回品運搬人"
"","","","","","","429-02","学童保育指導員 ","学童保育指導員"
"","","","","","","429-03","カイロプラクティック・アロマセラピー等従事人","アロマセラピスト、カイロプラクター、整体師、タラソテラピスト、リフレクソロジスト"
"","","","","","","429-99","他に分類されないその他のサービスの職業","易者、エレベーター係、介添役（結婚式場）、家庭保育員、祈とう師、靴みがき人、結婚式場司会者、結婚相談員、コインランドリー管理人、職業紹介あっせん人（民営職業紹介）、寝具消毒乾燥人、人生相談員、美術モデル、ペットシッター、便利屋、保育補助者、保育ママ、巫女、野犬捕獲員、旅行案内係（旅行・観光案内所）、霊園管理者"
"F","保安の職業","43","自衛官","431","自衛官","431-01","自衛官","陸上自衛官、陸上自衛隊員、海上自衛官、海上自衛隊員、航空自衛官、航空自衛隊員、防衛大学校学生、防衛医科大学校学生"
"","","44","司法警察職員","441","警察官","441-01","警察官","刑事、空港警察署員、皇宮護衛官、水上警察隊員、鉄道警察隊員"
"","","","","442","海上保安官","442-01","海上保安官","巡視船乗組員、巡視艇乗組員"
"","","","","449","その他の司法警察職員","449-01","その他の司法警察職員","漁業監督官、狩猟取締特別司法警察官、麻薬取締官"
"","","45","その他の保安の職業","451","看守","451-01","看守","刑務官（管理職を除く）"
"","","","","452","消防員","452-01","消防員","救急救命士（消防員）、救急隊員、空港消防員、私設消防員、消防官、消防士、消防隊員、レスキュー隊員"
"","","","","453","警備員","453-01","施設警備員","駅警備員、ガードウーマン、ガードマン、機械警備員、空港警備員、刑事施設警備員、守衛、倉庫警備員、駐車場警備員、ビル警備員、夜警員"
"","","","","","","453-99","他に分類されない警備員","機械警備管制員、貴重品運搬警備員、現金輸送員、国会衛視、身辺警護員、法廷警備員、ボディガード"
"","","","","459","他に分類されない保安の職業","459-01","道路管理員","交通巡視員、道路監理員、道路パトロール隊員"
"","","","","","","459-02","道路交通誘導員","建設現場交通誘導員、交通誘導員、道路工事現場交通誘導員"
"","","","","","","459-03","雑踏警備員","イベント警備員、会場整備員、催事警備員"
"","","","","","","459-04","プール・海水浴場監視員","海水浴場監視員、水泳場監視員、プール監視員、ライフガード"
"","","","","","","459-99","他に分類されないその他の保安の職業","自然保護官（レンジャー）、児童交通擁護員、駐車監視員、入国警備官、列車見張員（保線工事）"
"G","農林漁業の職業","46","農業の職業","461","農耕作業員","461-01","稲作・畑作作業員 ","いも類栽培作業員、雑穀栽培作業員、水稲栽培作業員、豆類栽培作業員、野菜栽培作業員"
"","","","","","","461-02","園芸・工芸作物栽培作業員","い草栽培作業員、植木栽培作業員、 花き栽培者、果樹栽培者、芝栽培作業員、たばこ栽培作業員、茶栽培作業員"
"","","","","","","461-03","きのこ栽培作業員","えのきだけ栽培作業員、きのこ類製造作業員（工場生産）、椎茸栽培作業員、舞茸栽培作業員、マッシュルーム栽培作業員"
"","","","","","","461-04","ハウス野菜栽培作業員","温室野菜栽培作業員、そ菜栽培作業員（ハウス栽培）"
"","","","","","","461-99","他に分類されない農耕作業員","椎茸種駒製造作業員、種苗栽培員（農業）、植物園栽培係員、農園管理人、農耕用トラクター運転手、もやし製造作業員（工場生産）"
"","","","","462","養畜作業員","462-01","肉牛・乳牛飼育作業員","搾乳作業員、肉牛飼育作業員、乳牛飼育作業員、酪農作業員、酪農ヘルパー"
"","","","","","","462-02","養豚作業員","豚舎作業員、豚飼育管理作業員、養豚場作業員"
"","","","","","","462-03","養鶏作業員","鶏舎作業員、集卵作業員（養鶏場）、鶏飼育管理作業員、ブロイラー飼育作業員"
"","","","","","","462-04","動物飼育係","愛がん用動物飼育作業員、研究用動物世話係、実験動物飼育係、動物園飼育係"
"","","","","","","462-05","きゅう務員","競走馬飼育作業員、種馬飼育作業員"
"","","","","","","462-06","養蚕作業員","蚕飼育員、蚕種製造作業員、収繭作業員"
"","","","","","","462-99","他に分類されない養畜作業員","動物繁殖作業員、ブリーダー、牧場作業員、養蜂作業員"
"","","","","463","植木職、造園師","463-01","植木職","植木屋、庭木屋"
"","","","","","","463-02","造園師","ゴルフ場芝植付作業員、芝植付作業員（造園業）、造園技能士、築庭作業員、庭師"
"","","","","","","463-98","植木職見習、造園師見習","植木職（見習）、造園師（見習）"
"","","","","469","その他の農業の職業","469-01","その他の農業の職業","装てい師、農業用水管理員、農薬散布作業員"
"","","47","林業の職業","471","育林作業員","471-01","地ごしらえ・植林作業員","山林苗木植付作業員、林業地ごしらえ作業員"
"","","","","","","471-02","下刈・枝打作業員","山林枝打作業員、山林下刈作業員、除伐作業員"
"","","","","","","471-99","他に分類されない育林作業員","林木計測作業員、雪起作業員"
"","","","","472","伐木・造材・集材作業員","472-01","伐木・造材・集材作業員","運材作業員、間伐作業員、集材作業員、造材作業員、伐木作業員"
"","","","","479","その他の林業の職業","479-01","山菜・うるし等採取作業員","うるし採取作業員、きのこ採取作業員、特用林産物採取作業員、まつたけ採取作業員、わらび採取作業員"
"","","","","","","479-02","山林監視員","山林管理人、山林保安係員、山林見回り作業員"
"","","","","","","479-03","製炭・製薪作業員","炭焼作業員、薪割作業員"
"","","","","","","479-99","他に分類されない林業の職業","山林苗木栽培作業員、山林病害虫防除作業員、種苗栽培作業員（林業）、狩猟員、鳥獣保護員、動物捕獲作業員"
"","","48","漁労作業員","481","漁労作業員","481-01","海面漁労作業員","沿岸漁業者、地びき網ひき作業員、潜水漁師、定置網漁師"
"","","","","","","481-02","漁船甲板員","いか釣り漁師、漁船乗組員、漁労船機関部員、漁労船操舵手、漁労長、刺網漁師、敷網漁師、底引き網漁師、はえなわ漁師、巻網漁師"
"","","","","","","481-03","内水面漁労作業員 ","あゆ漁師、鵜匠、うなぎ漁師、川魚漁師、投網漁師、内水面漁師"
"","","","","482","漁労船の船長・航海士・機関長・機関士","482-01","漁労船の船長・航海士・機関長・機関士","漁労船機関士、漁労船機関長、漁労船航海士、漁労船船長"
"","","","","483","海藻・貝類採取作業員","483-01","海藻・貝類採取作業員","うに採取作業員、昆布採取作業員、しじみ採取作業員、水産あま（海女・海士）、のり採取作業員"
"","","","","484","水産養殖作業員","484-01","魚類養殖作業員","うなぎ養殖作業員、金魚養殖作業員、鯉養殖作業員、たい養殖作業員、はまち養殖作業員、ふぐ養殖作業員"
"","","","","","","484-02","貝類養殖作業員","かき養殖作業員、しじみ養殖作業員、帆立貝養殖作業員"
"","","","","","","484-03","真珠養殖作業員","真珠筏管理員、真珠核入作業員、真珠玉入作業員、養殖真珠貝掃除作業員"
"","","","","","","484-04","のり・わかめ等養殖作業員","昆布養殖作業員、のり養殖作業員、わかめ養殖作業員"
"","","","","","","484-99","他に分類されない水産養殖作業員","ごかい養殖作業員、水産試験場飼育作業員、 水族館飼育作業員、すっぽん養殖作業員"
"","","","","489","その他の漁業の職業","489-99","その他の漁業の職業","漁場監視員、魚類水揚作業員、釣餌採取作業員"
"H","生産工程の職業","49","生産設備制御・監視の職業（金属材料製造、金属加工、金属溶接・溶断）","491","製銑・製鋼・非鉄金属製錬設備制御・監視員","491-01","製銑・製鋼設備制御・監視員","鋳物用鉄溶融設備オペレーター、高炉オペレーター、製鋼設備オペレーター、製銑設備オペレーター、造塊設備オペレーター、鋳銑機オペレーター、電気炉オペレーター（製鋼）、転炉オペレーター（製鋼）、取べ精錬炉オペレーター、連続鋳造機オペレーター（製鋼）"
"","","","","","","491-02","非鉄金属製錬設備制御・監視員","鋳物用アルミ溶解設備オペレーター、多結晶シリコン精錬設備オペレーター、非鉄金属浸出・浄液設備オペレーター、非鉄金属電解設備オペレーター、非鉄金属溶融設備オペレーター、連続鋳造機オペレーター（非鉄金属）"
"","","","","492","鋳造・鍛造設備制御・監視員","492-01","鋳造設備制御・監視員","鋳物製造設備オペレーター、造型機オペレーター、ダイカスト設備オペレーター"
"","","","","","","492-02","鍛造設備制御・監視員","鍛造加熱設備オペレーター、鍛造設備オペレーター、鍛造プレス設備オペレーター、ばね製造設備オペレーター（熱間成形によるもの）"
"","","","","493","金属工作設備制御・監視員","493-01","金属工作設備制御・監視員","金属工作設備オペレーター"
"","","","","494","金属プレス設備制御・監視員","494-01","金属プレス設備制御・監視員","金属プレス設備オペレーター"
"","","","","495","鉄工・製缶設備制御・監視員","495-01","鉄工・製缶設備制御・監視員","圧力容器製造設備オペレーター、鉄骨製造設備オペレーター、ボイラー製造設備オペレーター"
"","","","","496","板金設備制御・監視員","496-01","板金設備制御・監視員","製缶設備オペレーター（缶詰・飲料用の缶）、板金設備オペレーター、曲ロール機オペレーター（板金）"
"","","","","497","めっき・金属研磨設備制御・監視員","497-01","めっき設備制御・監視員","めっき設備オペレーター"
"","","","","","","497-02","金属研磨設備制御・監視員","金属研磨設備オペレーター"
"","","","","498","金属溶接・溶断設備制御・監視員","498-01","金属溶接・溶断設備制御・監視員","ガス切断設備オペレーター、金属溶接設備オペレーター、金属溶断設備オペレーター、溶接ロボットオペレーター、レーザー切断設備オペレーター"
"","","","","499","その他の生産設備制御・監視の職業（金属材料製造、金属加工、金属溶接・溶断）","499-01","金属熱処理設備制御・監視員","金属熱処理設備オペレーター"
"","","","","","","499-02","圧延設備制御・監視員","圧延加熱設備オペレーター、圧延設備オペレーター、溶接鋼管製造設備オペレーター、条鋼圧延設備オペレーター、熱間圧延設備オペレーター、冷間圧延設備オペレーター"
"","","","","","","499-03","伸線設備制御・監視員","伸線設備オペレーター"
"","","","","","","499-04","金属切断設備制御・監視員（刃物によるもの）","金属切断設備オペレーター、シャーリング設備オペレーター"
"","","","","","","499-99","他に分類されない生産設備制御・監視の職業（金属材料製造、金属加工、金属溶接・溶断）","金属線製品製造設備オペレーター、金属焙焼設備オペレーター、くぎ製造設備オペレーター、ばね製造設備オペレーター（冷間成形によるもの）、はんだ付設備オペレーター、粉鉱石焼結設備オペレーター、粉末冶金製品製造設備オペレーター、ろう付設備オペレーター"
"","","50","生産設備制御・監視の職業（金属材料製造、金属加工、金属溶接・溶断を除く）","501","化学製品生産設備制御・監視員","501-01","石油精製設備制御・監視員","潤滑油製造設備オペレーター、石油精製設備オペレーター、石油タンクオペレーター、燃料製造設備オペレーター"
"","","","","","","501-02","基礎的化学製品製造設備制御・監視員","化学繊維原料製造設備オペレーター、化学肥料製造設備オペレーター、化学薬品製造設備オペレーター、石油化学製品製造設備オペレーター、汎用樹脂製造設備オペレーター、無機材料製造設備オペレーター、有機薬品製造設備オペレーター"
"","","","","","","501-03","化学繊維製造設備制御・監視員","化学繊維後処理設備オペレーター、化学繊維原液調整設備オペレーター、化学繊維精練設備オペレーター、化学繊維漂白設備オペレーター、化学繊維紡糸設備オペレーター"
"","","","","","","501-04","医薬品・化粧品製造設備制御・監視員","医薬品製造設備オペレーター、化粧品製造設備オペレーター"
