"Large","name(Large)","Medium","name(medium)","Small","name(small)","Fine","name(fine)","Applicable example"
"","","","","","","542-99","Ceramics and earth and stone product manufacturers that are not classified elsewhere","Cloisonne, lime maker, gypsum product maker, gypsum maker, enamel maker, ceramic painter, ceramic raw material maker, crucible maker"
"","","","","543","Milled / milled / seasoned food manufacturer","543-01","Fine grainer","Wheat mill, rice mill"
"","","","","","","543-02","Miller","Wheat flour maker, starch maker"
"","","","","","","543-03","Taste and soy sauce maker","Soy sauce maker, miso maker"
"","","","","","","543-99","Fine grain / milling / seasoning food manufacturer not classified elsewhere","Yeast maker, umami seasoning maker, dried soup maker, yeast / koji maker, spice maker, jam maker, edible oil and fat product maker, vinegar maker, sugar maker, sauce maker, animal and vegetable fat maker , Tomato ketchup maker, peanut butter maker, margarine maker, mayonnaise maker, water candy maker"
"","","","","544","Men's manufacturer","544-01","Manufacture","Udon maker, spaghetti maker, handmade soba maker, ramen maker"
"","","","","","","544-02","Instant noodle maker","Instant noodle maker, instant noodle maker"
"","","","","","","544-99","Noodle maker not classified elsewhere","Gyoza skin maker, Shumai skin maker, Harusame maker, Macaroni maker, Wonton skin maker"
"","","","","545","Bread and confectionery maker","545-01","Bread / baked confectionery maker","Bakery, bread dough preparation, bread baking, baked confectionery baking, baked confectionery molding"
"","","","","","","545-02","Western confectionery maker","Castella maker, cake maker, cream puff maker, jelly maker, pastry chef (western confectionery maker), pudding maker, western confectionery finisher, western confectionery maker"
"","","","","","","545-03","Japanese confectionery maker","Manju maker, Daifuku maker, Dorayaki maker, Manju maker, Monaka maker, Yokan maker, Japanese sweets finisher"
"","","","","","","545-04","Japanese dried sweets maker","Hail maker, Okoshi maker, Karinto maker, Senbei maker, Bean confectionery maker, Rakugan maker"
"","","","","","","545-05","Snacks, candy, chocolate makers","Candy maker, caramel maker, candy maker, chocolate maker, drop maker, potato chips maker, nougat maker"
"","","","","","","545-99","Bread and confectionery maker not classified elsewhere","Popsicle maker, Amanatto maker, chewing gum maker, Chinese manju maker, tsukemono candy maker, sherbet maker, cotton candy maker"
"","","","","546","Tofu / konjac / fu maker","546-01","Manufacturer of tofu, fried tofu, etc.","Yuage maker, Ganmodoki maker, Frozen tofu maker, Tofu maker, Natto maker, Raw fried maker, Grilled tofu maker, Yuba maker"
"","","","","","","546-02","Konjac maker","Board konjac maker, thread konjac maker, Shirataki maker, ball konjac maker"
"","","","","","","546-03","Maker","Fried Fu Manufacturing, Kakufu Manufacturing, Raw Fu Manufacturing, Yakifu Manufacturing"
"","","","","547","Canned / bottled / retort food manufacturer","547-01","Canned food manufacturer","Canned food raw material cooker, canned food sterilization heater, canned food filling work, canned food sealing work, winding deaeration work (canning manufacturing)"
"","","","","","","547-02","Bottled food maker","Bottled food ingredient cooker, bottled food sterilizer heater, bottled food filling worker, bottled food sealer"
"","","","","","","547-03","Retort food maker","Retort food raw material cooker, retort food sterilization heater, retort food filling work, retort food sealing work"
"","","","","548","Milk and dairy product manufacturer","548-01","Drinking milk maker","Milk maker, milk bottling maker, raw milk sterilizer, low-fat milk maker, Tokuno milk maker"
"","","","","","","548-02","Lactic acid fermented product manufacturer","Lactic acid bacteria beverage maker, fermented milk maker, yogurt maker"
"","","","","","","548-03","Ice cream maker","Ice cream raw material weighing work, ice cream filling work, ice cream cooling work"
"","","","","","","548-99","Milk and dairy products manufacturers not classified elsewhere","Milk powder maker, condensed milk maker, cheese maker, butter maker, milk powder maker, condensed milk maker"
"","","","","551","Processed meat manufacturer","551-01","Butcher","Carcass dismantling, carcass processing, meat processing, minced meat manufacturing, minced meat manufacturing"
"","","","","","","551-02","Ham, bacon and sausage maker","Wiener maker, cutter maker (meat product), smoker maker (meat product), brewer (bird and animal meat product), meat stuffer (ham and sausage maker), boil maker (ham and sausage maker)"
"","","","","","","551-99","Processed meat product manufacturer not classified elsewhere","Kasuzuke meat maker, beef tsukudani maker, edible chicken dismantling maker"
"","","","","552","Fisheries processor","552-01","Katsuobushi maker","Ara-bushi maker, bonito raw cutting bonito, bonito bone removal maker, dead bonito maker, mackerel knuckle maker, namari-bushi maker, tuna-bushi maker"
"","","","","","","552-02","Seafood dried fish maker","Horse mackerel dried fish maker, sakura shrimp maker, dried squid maker, sardine maker, dried scallop maker, dried seaweed maker, dried hijiki maker"
"","","","","","","552-03","Fisheries product manufacturer","Kamaboko maker, fish sausage maker, satsuma fried maker, chikuwa maker, hanpen maker"
"","","","","","","552-99","Unclassified marine product processor","Squid salted fish maker, Kazunoko maker, Agar maker, Seafood kun maker, Konbu maker, Seafood salt brewer, Fisheries delicacy maker, Tsukudani maker, Tokoroten maker"
"","","","","553","Preserved food / frozen processed food manufacturer","553-01","Preserved food manufacturer","Ochazuke seaweed maker, instant miso soup maker, packaged cooked rice maker"
"","","","","","","553-02","Freezing processed food manufacturer","Frozen udon maker, frozen fried shrimp maker, frozen croquette maker, frozen pilaf maker"
"","","","","554","Bento / side dish manufacturer","554-01","Bento / side dish manufacturer","Fried food maker, side dish maker, cooking bread maker, bento maker"
"","","","","555","Vegetable maker","555-01","Vegetable maker","Umeboshi pickles, Senmaizuke, Takuan pickles, pickles (vegetables), Fukujin pickles, vegetable salt pickles, scallions pickles"
"","","","","556","Beverage / tobacco maker","556-01","Tea maker","Tea maker"
"","","","","","","556-02","Sake maker","Mr. Mori, a sake maker"
"","","","","","","556-03","Liquor maker (excluding sake)","Fruit liquor maker, grilled liquor maker, beer maker, mirin maker, wine maker"
"","","","","","","556-04","Soft drink maker","Tea-based beverage maker, mineral water maker, milk coffee maker"
"","","","","","","556-05","Tobacco maker","Tobacco maker"
"","","","","","","556-99","Beverage and tobacco manufacturers not classified elsewhere","Instant coffee maker, coffee bean roaster, powdered beverage maker"
"","","","","557","Weaver","557-01","Rough spinning, fine spinning","Mixed cottonwork, fine spinning, rough spinning, spinning"
"","","","","","","557-02","Noodle threader, processed threader","Processed yarn, synthetic yarn, yarn"
"","","","","","","557-03","Woven fabric preparatory work","Loom preparatory work, warping work, hata (machine) preparation work, he (warp) commuting work"
"","","","","","","557-04","Weaving","Loom operator, weaving"
"","","","","","","557-05","Smelting and bleaching","Smelter (spinning, textile manufacturing), bleaching (spinning, textile manufacturing), bleaching finisher (spinning, textile manufacturing)"
"","","","","","","557-06","Dyeing / finishing work","Textile dyeing, thread dyeing, dyeing, screen dyeing, dyeing and finishing (spinning, textile manufacturing), dyeing, toning (fiber), dyeing, Yuzen dyeing"
"","","","","","","557-07","Knitting and knitting","Knitting machine preparation, knitting, knitting, machine lace knitting, socks knitting, hand knitting, knit fabric knitting, knit product knitting, lace knitting"
"","","","","","","557-08","Tsuna / Ami Manufacturing","Ami maker, Tsuna maker, String maker"
"","","","","","","557-09","Felt / non-woven fabric manufacturer","Non-woven fabric manufacturer, felt manufacturer"
"","","","","","","557-99","Weavers not classified elsewhere","Thread finishing work, silk reeling work, woven fabric post-treatment work, cotton making work, cotton punching direct work"
"","","","","558","Garment / textile manufacturer","558-01","Women's clothing / children's clothing tailoring","Dressmaker, women's ready-to-wear tailor, women's clothing tailor, women's clothing order tailoring, children's ready-to-wear tailoring, children's clothing tailoring, children's clothing ordering, dressmaker (women's clothing / children's clothing tailoring)"
"","","","","","","558-02","Men's clothing tailoring","Men's ready-made clothing tailor, men's clothing order tailoring, tailor, dressmaker (men's clothing tailoring)"
"","","","","","","558-03","Kimono tailoring job","Japanese dressmaker"
"","","","","","","558-04","Clothes repairman","Clothes repairer, men's clothing repairer, women's clothing / children's clothing repairer, clothing repairer, reformer (clothing), kimono repairer"
"","","","","","","558-05","Fabric cutting work","Machine cutting work, hand cutting work (cloth)"
"","","","","","","558-06","Sewing machine (clothes)","Clothes sewing machine sewing, underwear sewing, shirt sewing, men's clothing sewing, sewing workers (clothes), knit sewing, women's clothing / children's clothing sewing"
"","","","","","","558-07","Sewing machine sewing machine (personal items)","Sewing machines other than clothes, curtain sewing machines, quilting sewing machines, woven fabric sewing machines, personal belongings sewing machines, sewing workers (personal belongings)"
"","","","","","","558-08","Special sewing machine sewing machine","Sewing workers (special sewing machines)"
"","","","","","","558-09","Embroidery","Machine embroidery, hand embroidery"
"","","","","","","558-10","Clothes and textile finishers","Textile finisher, textile hand finisher, textile press"
"","","","","","","558-99","Clothes and textile manufacturers not classified elsewhere","Leather sewing (clothing manufacturing), cambus product manufacturing, fur cutting (clothing), bedding tailoring, sail cloth product manufacturing, hat manufacturing (cloth), leather clothing tailoring, duvet cotton"
"","","","","561","Wooden product manufacturer","561-01","Sawmill, chip maker","Log cutting work, chipper work, chip sorting work, sawing machine work"
"","","","","","","561-02","Plywood","Decorative plywood maker, plywood maker, plywood press maker, laminated wood maker, single board maker, preparation board maker, particle board maker, wood board maker"
"","","","","","","561-03","Woodworking, wood carving","Drilling woodworking, machine pre-cutting, machine woodworking, woodworking woodworking, wood carving, doll carving, woodblock maker, woodworking polisher, woodworking lathe, woodworking milling machine"
"","","","","","","561-04","Wooden furniture and joinery manufacturer","Furniture worker, shoji installation worker, joinery worker, wooden furniture metal fittings assembler, wooden furniture assembler, wooden furniture repairman"
"","","","","","","561-05","Sashimono","Karaki joinery, wooden mirror stand maker, god and Buddhist joinery, Buddhist altar maker, palace master, parquet craftsman"
"","","","","","","561-06","Wood insect repellent and antiseptic treatment work","Wood product processing work, wood fireproof treatment work, wood insect repellent treatment work, wood antiseptic treatment work"
"","","","","","","561-99","Wooden product manufacturer not classified elsewhere","Igusa product maker, rice straw product maker, kiyanagi product maker, geese maker, bamboo maker, tofu product maker, ship carpenter, straw product maker, wooden exercise equipment maker, wooden skein maker, wooden barrel Manufacturer, wooden music maker"
"","","","","562","Pulp / paper / paper product manufacturer","562-01","Pulp worker, paper worker","Paper fee work, paper fee adjustment work, paper fee melting work, pulp work, pulp grinder work"
"","","","","","","562-02","Paper plow","Paper machine, paper machine, paper machine"
"","","","","","","562-03","Cardboard maker","Corrugated cardboard sheet maker"
"","","","","","","562-04","Processed paper maker (excluding corrugated cardboard)","Coated paper maker, waterproof paper maker"
"","","","","","","562-05","Paper container maker","Large paper bag maker, paper tableware maker, paper box maker, mechanical box maker, paper tube maker, cardboard box maker"
"","","","","","","562-06","Paper product manufacturer","Paper string maker, small paper bag maker, envelope maker"
"","","","","","","562-07","Paper cutting","Paper die cutting work, paper machine cutting work, bookbinding cutting work"
"","","","","","","562-99","Pulp / paper / paper product manufacturers not classified elsewhere","Paper processing work, paper finishing work, paper product finishing work, paper winding work"
"","","","","563","Printing / binding worker","563-01","DTP operator","DTP operator"
"","","","","","","563-02","Phototypesetting operator","Phototypesetting typesetting worker, computerized typesetting operator, electronic typesetting operator"
"","","","","","","563-03","Plate making worker","Offset plate making worker, color scanner operator, gravure plate making worker, screen plate making worker, plate making camera worker, electronic plate making worker, block copy production worker"
"","","","","","","563-04","Toppan printing worker","Resin letterpress printing worker, flexo printing worker"
"","","","","","","563-05","Offset printing worker","Flat plate printing worker"
"","","","","","","563-06","Gravure printing worker","Intaglio printing worker, photo printing worker, art printing worker"
"","","","","","","563-07","Screen printing worker","Signboard printing worker, stencil printing worker, silk printing worker"
"","","","","","","563-08","Sticker printing worker","Sticker printing worker, label printing worker"
"","","","","","","563-09","Proofreading worker","Proofreading worker"
"","","","","","","563-10","Printed matter gloss processing worker","Printed matter coating processing worker, printed matter resin press processing worker, printed matter laminating processing worker"
"","","","","","","563-11","Bookbinding worker","Folding worker, bookbinding finishing worker, bookbinding binding worker, collating worker, cover manufacturing worker"
"","","","","","","563-99","Printing and binding workers not classified elsewhere","Pushing worker, form printing worker"
"","","","","564","Rubber product manufacturer","564-01","Raw material rubber processor","Raw material rubber rolling work, raw material rubber mixing work, raw material rubber kneading work, raw material rubber pretreatment work, raw material rubber chemical compounding work"
"","","","","","","564-02","Tire molder","Vulcanizer (tire molding), automobile tire molding, tire rubber lining, tread (tire manufacturing)"
"","","","","","","564-03","Rubber product molding (excluding tire molding)","Sulfurizer (excluding tire molding), rubber assemble molding, rubber extrusion molding, rubber molding, rubber injection molding, rubber dipping molding, rubber press molding, rubber lining molding"
"","","","","","","564-04","Rubber cutting work","Rubber punching, rubber die punching, rubber cutting"
"","","","","","","564-05","Rubber coating work","Coating work (rubber cloth), rubber sheet work, rubber insulation work, rubber work, rubber waterproofing work"
"","","","","","","564-99","Rubber product manufacturer not classified elsewhere","Rubber joining work, rubber beaming work, rubber baking work, recycled rubber manufacturing work"
"","","","","565","Plastic product manufacturer","565-01","Raw material plastic processor","Synthetic resin kneading work, synthetic resin crushing work, plastic kneading work"
"","","","","","","565-02","Plastic molder","Plastic compression molding, plastic extrusion molding, plastic injection molding, plastic laminated molding, plastic handmade molding, plastic heat molding, plastic foam molding, plastic blow molding, plastic roll rolling"
"","","","","","","565-03","Plastic cutting and polishing work","Plastic cutting machinist, plastic lathe, plastic buff polisher, plastic drilling machine"
"","","","","","","565-04","Plastic joining and cutting work","Punching (plastic product manufacturing), high frequency welder (plastic product manufacturing), high frequency sewing machine, plastic product cutting"
"","","","","","","565-05","Plastic coating work","Insulation resin coating work, plastic waterproofing work, laminating work (plastic coating)"
"","","","","","","565-99","Plastic product manufacturer not classified elsewhere","Plastic engraver"
"","","","","569","Other product manufacturing / processing occupations (excluding metal material manufacturing, metal processing, metal welding / fusing)","569-01","Leather / leather product manufacturer","Leather punching work, leather tool processing work, leather shoe repair work, leather shoe manufacturing work, leather cutting work, leather sandal manufacturing work, leather slipper manufacturing work, leather sewing work, leather making work, leather finishing work, leather making preparation work, tanning work"
"","","","","","","569-02","Bag / bag manufacturer","Bag maker, bag sewn, bag maker, bag sewn"
"","","","","","","569-03","Precious metals, jewels, insteps, square work","Shellwork, precious metal work, kiba work, instep work, pearl work, crystal polishing, square work, jewel work"
"","","","","","","569-04","Musical instrument maker","Musical instrument assembler, piano assembler, violin maker"
"","","","","","","569-05","Toy manufacturer","Toy assembler, doll maker, children's vehicle maker"
"","","","","","","569-06","Exercise equipment manufacturer","Golf club maker, ski maker, training equipment maker, baseball mitt maker"
"","","","","","","569-07","Writing instrument manufacturer","Pencil maker, ballpoint pen maker, fountain pen assembler, brush maker"
"","","","","","","569-08","Lacquer ware","Lacquer ware, lacquer ware decorator, lacquer ware apprentice, firewood artist"
"","","","","","","569-09","Broom / brush maker","Broom maker, brush maker, toothbrush maker, brush maker, scrubbing brush maker"
"","","","","","","569-10","Model / imitation maker","Wig maker, food model maker, hair piece maker, model maker"
"","","","","","","569-11","Formulated feed maker","Formulated feed maker"
"","","","","","","569-12","Liner","Chair lining work, lining filling work, furniture lining work, aircraft lining work, small box covering work, car lining work, car seat assembly work, ship lining work, vehicle lining work, passenger car interior Zhang work"
"","","","","","","569-13","Zhuangbiao","Shoji, Shoji, Shoji, Folding screen, Fusuma"
"","","","","","","569-99","Occupations of product manufacturing / processing that are not classified elsewhere (excluding metal material manufacturing, metal processing, metal welding / fusing)","Sealer, fan maker, smoking equipment maker, animal skin stripping maker, ice maker, lantern maker, livestock worker, fastener maker, match maker, organic fertilizer maker (chicken manure, fish fertilizer, compost, soybean meal, etc. ), Yogasa maker"
"","","57","Machine assembly profession","571","General machinery and equipment assembler","571-01","Motor assembler","Aircraft engine assembler, automobile engine assembler, ship engine assembler, turbine assembler"
"","","","","","","571-02","Metalworking machine assembler","Rolling machine assembler, metal machine tool assembler, lathe assembler, forging machine assembler, milling machine assembler, press machine assembler"
"","","","","","","571-03","Agricultural machine assembler","Tiller assembler, combine assembler, rice transplanter assembler, agricultural tractor assembler"
"","","","","","","571-04","Construction machinery assembler","Construction crane assembler, excavator car assembler, bulldozer assembler"
"","","","","","","571-05","Printing / binding machine assembler","Offset printing machine assembler, screen printing machine assembler, bookbinding machine assembler"
"","","","","","","571-06","Semiconductor / LCD panel manufacturing equipment assembler","Wafer cutting machine assembler, LCD panel substrate bonding machine assembler, semiconductor manufacturing equipment assembler, semiconductor cleaning equipment assembler"
"","","","","","","571-07","Commercial freezing / refrigerating / air-conditioning equipment assembler","Air conditioner assembler, ice maker assembler, refrigerator assembler, chiller assembler"
"","","","","","","571-08","Service / entertainment machine assembler","Automatic ticket gate assembler, car washing machine assembler, vending machine assembler, dry cleaning machine assembler, game machine assembler"
"","","","","","","571-09","Machine parts assembler","Bearing assembler, shaft joint assembler, chain assembler, valve assembler, transmission assembler, bearing assembler"
"","","","","","","571-99","General machinery and equipment assembler not classified elsewhere","Elevator installation, elevator installation, food filling machine assembly, textile machine assembly, packaging machine assembly, woodworking machine assembly"
"","","","","572","Electromechanical assembler","572-01","Generator / motor assembler","Industrial motor assembler, electric motor winding builder, micromotor assembler, consumer generator assembler"
"","","","","","","572-02","Switchboard / control panel / open / close control equipment assembler","Open / close control equipment assembler, switch assembler, control panel assembler, electric control panel assembler, switchboard assembler, breaker assembler"
"","","","","","","572-03","Electromechanical parts assembler","Inverter assembler, rectifier assembler, commutator assembler, capacitor assembler for power circuit"
"","","","","","","572-99","Electrical machinery assembler not classified elsewhere","Transformer winding work, transformer assembler, transformer assembler, current transformer assembler"
"","","","","573","Telecommunications machinery and equipment assembler","573-01","Wireless / wired communication equipment assembler","Car navigation assembler, mobile phone assembler, telephone assembler, facsimile assembler, wireless communication equipment assembler, wired communication equipment assembler"
"","","","","","","573-02","TV / radio assembler","TV assembler, radio assembler"
"","","","","","","573-99","Telecommunications machinery and equipment assembler not classified elsewhere","Traffic signal assembler, radar assembler"
"","","","","574","Electronic applied machinery and equipment assembler","574-01","Computer assembler","Personal computer assembler, general-purpose computer assembler"
"","","","","","","574-02","Electronic copier assembler","Copier assembler, compound copier assembler"
"","","","","","","574-99","Electronic applied machinery and equipment assembler not classified elsewhere","Medical image radiation equipment assembler, medical electronic equipment assembler, X-ray application equipment assembler, underwater hearing equipment assembler, ultrasonic diagnostic imaging equipment assembler, laser application processing equipment assembler"
"","","","","575","Consumer electronic and electrical machinery and equipment assemblers","575-01","Consumer electronic and electrical machinery and equipment assemblers","Acoustic equipment assembler, car air conditioner assembler, household air conditioner assembler, electric lighting equipment assembler, electric stove assembler, electric washing machine assembler, vacuum cleaner assembler, electric refrigerator assembler, electric heater assembler"
"","","","","576","Semiconductor product manufacturer","576-01","Semiconductor chip manufacturer","Semiconductor edging work, semiconductor circuit pattern baking work, semiconductor electrode forming work, semiconductor resist coating work"
"","","","","","","576-02","Semiconductor assembler","Semiconductor encapping work, semiconductor exterior processing work, semiconductor dicing work, semiconductor encapsulation work, semiconductor mounting work, wire bonding work"
"","","","","","","576-99","Semiconductor product manufacturer not classified elsewhere","Semiconductor marking work, semiconductor laser printing work"
"","","","","577","Light bulb / electron tube assembler","577-01","Light bulb / electron tube assembler","Light bulb maker, light bulb parts assembler, electron tube maker, electron tube parts assembler"
"","","","","578","Dry cell / storage battery manufacturer","578-01","Dry cell / storage battery manufacturer","Alkaline battery maker, lead-acid battery maker, battery maker"
"","","","","581","Coated wire manufacturer","581-01","Coated wire manufacturer","Garbage (armor) lining, paper winding maker, rubber wire maker, vinyl wire maker, coating maker, polyethylene wire maker, stranded wire maker"
"","","","","582","Cable ties","582-01","Cable ties","Telecommunications equipment bundle wire work, electronic application equipment bundle wire work, transportation equipment bundle wire work, wire harness work"
"","","","","583","Electronic equipment parts assembler","583-01","Capacitor assembler for electronic circuits","Capacitor manufacturer for electronic devices"
"","","","","","","583-02","Printed circuit board assembler","Printed circuit board maker, printed wiring maker, printed wiring board maker"
"","","","","","","583-03","Liquid crystal display parts assembler","Liquid crystal display parts assembler, plasma display parts assembler"
