"Large","name(Large)","Medium","name(medium)","Small","name(small)","Fine","name(fine)","Applicable example"
"A","管理的職業","01","Administrative civil servant","011","Administrative civil servant","011-01","Parliamentarian","Member of Parliament, Member of the House of Representatives, Member of the House of Representatives, Member of the Local Public Organization, Member of the Prefectural Assembly, Member of the Municipal Assembly"
"","","","","","","011-02","Administrative national civil servant","Minister of State, Deputy Minister, Parliamentary Secretary, Administrative Vice-Minister, Bureau / Department / Section Chief of Central Ministry, Bureau / Department / Section Chief of Local Branch Offices"
"","","","","","","011-03","Administrative local civil servant","Governor, Deputy Governor, Account Manager (Prefecture), Municipal Mayor, Deputy Mayor, Account Manager (Municipal), Bureau / Department / Section Manager of Local Public Organization, Chief / Section Manager of Local Public Organization Branch Office"
"","","02","Corporate / organization officers","021","Company executive","021-01","Company executive","CEO (Chief Executive Officer), Company President, Company Director, Company Auditor, Company Executive Officer, Company Manager (Director), Company Factory Manager (Director)"
"","","","","029","Officers of other corporations / organizations","029-01","Officers of incorporated administrative agencies, etc.","Incorporated Administrative Agency officers (Chairman, Director, Auditor), National University Corporation Officer (President, Director, Auditor), Local Incorporated Administrative Agency Officer (Chairman, Director, Auditor), Public University Corporation Officer (President, Director, Auditor) , Japan Broadcasting Corporation officers (Chairman, Vice Chairman, Directors), Bank of Japan officers (President, Directors, Auditors), Special Company Officers (President, Directors, Audit & Supervisory Board Members)"
"","","","","","","029-99","Officers of corporations and organizations that are not classified elsewhere","Cooperative officers, employers' organization officers, public interest incorporated foundation officers, public interest incorporated association officers, labor union officers"
"","","03","Management staff of corporations / organizations","031","Company management staff","031-01","Company management staff","Headquarters department manager, factory / branch / sales office manager, factory / branch manager, executive officer (not a company officer such as director), bank branch manager, sales manager (mainly engaged in administrative work) (What to do), accounting section chief (mainly engaged in administrative work), retail store manager (company: mainly engaged in administrative work), wholesale store manager (company: mainly engaged in administrative work) (Things), restaurant manager (company: mainly engaged in administrative work), hotel manager (company: mainly engaged in administrative work), inn manager (company: mainly engaged in administrative work) What to do)"
"","","","","039","Welfare facility manager","039-01","Administrative staff of incorporated administrative agencies, etc.","Chief of an independent administrative agency, chief of a national university corporation, chief of a local independent administrative agency, chief of a public university corporation, chief of the Bank of Japan, chief of a special company"
"","","","","","","039-02","Welfare facility manager","Welfare facility manager for the disabled, special elderly nursing home facility manager, dementia elderly group home manager (mainly engaged in administrative work), nursing home facility manager, elderly day service center manager (mainly management) Those who engage in typical work)"
"","","","","","","039-99","Administrative staff of corporations / organizations that are not classified elsewhere","Cooperative Department Manager, Employers' Organization Department Manager, Public Interest Incorporated Foundation Department Manager, Public Interest Incorporated Association Department Manager, Private School Secretary"
"","","04","Other administrative professions","049","Other administrative professions","049-99","Other administrative professions","Retail store manager (individual business: mainly engaged in administrative work), restaurant manager (individual business: mainly engaged in administrative work), inn manager (individual business: mainly engaged in administrative work) What to do)"
"B","Professional / technical occupation","05","researcher","051","researcher","051-01","Science researcher","Chemistry researcher, meteorology researcher, mathematics researcher, biology researcher, geology researcher, astronomy researcher, physics researcher"
"","","","","","","051-02","Engineering researcher","Mechanical engineering researcher, architectural engineering researcher, material engineering researcher, information engineering researcher, bioengineering researcher, electrical engineering researcher, electronic engineering researcher, civil engineering / architectural engineering researcher, biotechnology researcher"
"","","","","","","051-03","Agricultural / Forestry / Fisheries Researcher","Veterinary researchers, fisheries researchers, animal science researchers, agricultural researchers, forestry researchers"
"","","","","","","051-04","Medical researcher","Dental researcher, physiology researcher, pathology researcher, pharmacy researcher"
"","","","","","","051-05","Humanities researcher","Pedagogical researcher, historical researcher, psychological researcher, philosophical researcher, art researcher, literary researcher"
"","","","","","","051-06","Social science researcher","Business administration researcher, economics researcher, sociology researcher, commerce researcher, political science researcher, law researcher"
"","","","","","","051-99","Researchers not classified elsewhere","Nutrition researcher, home economics researcher, food chemistry researcher, mechatronics researcher"
"","","06","Agriculture, Forestry and Fisheries Engineer","061","Agriculture, Forestry and Fisheries Engineer","061-01","Agricultural engineer","Agricultural technology instructor, agricultural management instructor, agricultural product inspector, extension instructor (agriculture)"
"","","","","","","061-02","Livestock technician","Domestic animal insemination teacher (non-veterinarian), livestock technical instructor, chick discriminator, extension instructor (livestock), hatching egg technician, manure treatment technician"
"","","","","","","061-03","Forestry technician","Seedling engineer for forests, forest pest control engineer, extension instructor (forestry)"
"","","","","","","061-04","Fisheries engineer","Fisheries resource conservation instructor, extension instructor (fishery industry), aquaculture engineer"
"","","07","Development engineer","071","Food development technician","071-01","Food development technician","Fisheries food development engineer, soft drink development engineer, brewing engineer (development), dairy product development engineer"
"","","","","072","Electrical / electronic / telecommunications development engineer (excluding communication networks)","072-01","Electrical / electronic / telecommunications design engineer","Liquid crystal display (LCD) design engineer, circuit design engineer, television design engineer, telecommunications equipment design engineer, electronic equipment design engineer, electric motor design engineer, telephone design engineer, generator design engineer"
"","","","","","","072-99","Electrical / electronic / telecommunications development engineers not classified elsewhere (excluding communication networks)","TV development engineer (excluding design), electric motor development engineer (excluding design), telephone development engineer (excluding design), power transmission development engineer, generator development engineer (excluding design), semiconductor product development Engineer (excluding design)"
"","","","","073","Machine development engineer","073-01","Mechanical design engineer","Engine design engineer, chemical plant design engineer, mold designer, construction machine design engineer, aviation instrument design engineer, machine tool design engineer, industrial robot design engineer, precision measuring tool design engineer, civil engineering machine Design engineer, agricultural machine design engineer, semiconductor manufacturing equipment design engineer, boiler design engineer"
"","","","","","","073-99","Machine development engineer not classified elsewhere","Printing machine development engineer (excluding design), construction machine development engineer (excluding design), prime mover development engineer (excluding design), automated machine development engineer (excluding design), camera development engineer (design) (Excluding), precision measuring machine development engineer (excluding design), dyeing machine development engineer (excluding design)"
"","","","","074","Automobile development engineer","074-01","Automobile design engineer","Bus body design engineer"
"","","","","","","074-99","Automobile development engineer not classified elsewhere","Automobile development engineer (excluding design)"
"","","","","075","Transportation equipment development engineer (excluding automobiles)","075-01","Transportation equipment development engineer (excluding automobiles)","Aircraft design engineer, ship design engineer, shipbuilding engineer (development), railroad vehicle design engineer"
"","","","","076","Metal smelting / material development engineer","076-01","Metal smelting / material development engineer","Rolling development engineer, casting development engineer, metal smelting development engineer, alloy development engineer, iron making development engineer, forging development engineer, casting development engineer, electric refining development engineer"
"","","","","077","Chemical development engineer","077-01","Chemical development engineer","Chemical fiber development engineer, chemical fertilizer development engineer, chemical drug development engineer, cosmetics development engineer, synthetic rubber development engineer, polymer chemical product development engineer, biochemical development engineer, plastic product development engineer, fats and oils Product development engineer, inorganic chemical product development engineer, organic chemical product development engineer"
"","","","","079","Other development engineers","079-01","Ceramic product development engineer","Glass product development engineer, abrasive development engineer, cement development engineer, ceramics development engineer, fine ceramics product development engineer"
"","","","","","","079-99","Development engineers not classified elsewhere","Nuclear engineer (development), mine development engineer, mining development engineer, woven fabric development engineer, dyeing development engineer, exploration development engineer, spinning development engineer"
"","","08","Manufacturing technician","081","Food manufacturing technician","081-01","Food manufacturing technician","Canning engineers, food refrigeration engineers (excluding development engineers), brewing engineers (excluding development engineers), fishery food manufacturing engineers, sugar manufacturing engineers (excluding development engineers), flour milling engineers (development) (Excluding technicians), soft drink manufacturing technicians, dairy product manufacturing technicians"
"","","","","082","Electrical / electronic / telecommunications manufacturing engineer (excluding communication networks)","082-01","Electrical / electronic / telecommunications equipment production engineer","Electrical equipment production engineer, electronic equipment production engineer, telecommunications equipment production engineer"
"","","","","","","082-02","Electrician","Electrical work construction management engineer, electrical facility construction management engineer"
"","","","","","","082-99","Electrical / electronic / telecommunications manufacturing engineers not classified elsewhere (excluding communication networks)","Electrical / electronic equipment manufacturing engineers (excluding production engineers), telecommunications equipment manufacturing engineers (excluding production engineers)"
"","","","","083","Machine manufacturing engineer","083-01","Machine production engineer","Motor production engineer, machine tool production engineer, precision machine production engineer"
"","","","","","","083-99","Machine manufacturing technicians not classified elsewhere","Motor manufacturing engineer (excluding production engineer), machine tool manufacturing engineer (excluding production engineer), precision machine manufacturing engineer (excluding production engineer)"
"","","","","084","Automobile manufacturing engineer","084-01","Automobile production engineer","Automobile production engineer"
"","","","","","","084-99","Automakers not classified elsewhere","Automobile manufacturing engineer (excluding production engineer)"
"","","","","085","Transportation equipment manufacturing engineer (excluding automobiles)","085-01","Transportation equipment manufacturing engineer (excluding automobiles)","Aircraft manufacturing engineer, ship manufacturing engineer, railroad vehicle manufacturing engineer"
"","","","","086","Metal smelting / material manufacturing engineer","086-01","Metal smelting / material manufacturing engineer","Rolling engineer (excluding development engineer), casting engineer (excluding development engineer), metal smelting engineer (excluding development engineer), alloy engineer (excluding development engineer), iron making engineer (excluding development engineer) Development engineers (excluding development engineers), forging engineers (excluding development engineers), casting engineers (excluding development engineers), electric refining engineers (excluding development engineers)"
"","","","","087","Chemical manufacturing engineer","087-01","Chemical production engineer","Pharmaceutical production engineer, chemical fiber production engineer, chemical fertilizer production engineer, chemical production engineer, cosmetics production engineer, synthetic rubber production engineer, polymer chemical product production engineer, biochemical production engineer, plastic product Production engineer, inorganic chemical product production engineer, organic chemical product production engineer, oil and fat product production engineer"
"","","","","","","087-02","Analytical chemistry engineer","Pharmaceutical inspection technician, inorganic chemical analysis inspection technician, organic chemical analysis technician"
"","","","","","","087-99","Chemical manufacturing technicians not classified elsewhere","Pharmaceutical manufacturing engineers (excluding production engineers), chemical fiber manufacturing engineers (excluding production engineers), chemical fertilizer manufacturing engineers (excluding production engineers), chemical manufacturing engineers (excluding production engineers) , Cosmetics manufacturing engineer (excluding production engineer), synthetic rubber manufacturing engineer (excluding production engineer), polymer chemical product manufacturing engineer (excluding production engineer), plastic product manufacturing engineer (production engineer) ), Inorganic chemical product manufacturing engineer (excluding production engineer), organic chemical product manufacturing engineer (excluding production engineer), oil and fat product manufacturing engineer (excluding production engineer)"
"","","","","089","Other manufacturing technicians","089-01","Ceramic product manufacturing engineer","Glass product manufacturing engineer, abrasive manufacturing engineer, cement manufacturing engineer, fine ceramics product manufacturing engineer, ceramics manufacturing engineer"
"","","","","","","089-99","Manufacturing technicians not classified elsewhere","Nuclear engineer (excluding development engineer), mining engineer (excluding development engineer), weaving engineer (excluding development engineer), dyeing engineer (excluding development engineer), spinning engineer (development engineer) Excluding technicians)"
"","","09","Architecture / Civil Engineering / Surveyor","091","Building engineer","091-01","Architectural design engineer","Building structure design engineer, building designer, building equipment design engineer"
"","","","","","","091-02","Construction supervision","Construction site supervision, building construction management engineer"
"","","","","","","091-99","Construction engineer not classified elsewhere","Seismic diagnostician (architect), building inspector (architect)"
"","","","","092","Civil engineer","092-01","Civil engineering design engineer","Port design engineer, landscaping design engineer, railroad track design engineer, civil engineering facility design engineer"
"","","","","","","092-02","Civil engineering supervision","Civil engineering site supervisor, civil engineering construction management engineer"
"","","","","","","092-99","Civil engineer not classified elsewhere","Construction inspector (Regional Development Bureau), civil engineering inspector"
"","","","","093","Surveyor","093-01","Surveyor",""
"","","","","","","093-98","Assistant Surveyor",""
"","","10","Information processing / communication engineer","101","System consultant","101-01","System consultant","IT consultant"
"","","","","102","System design engineer","102-01","System design engineer","System architect, system analyst, in-house system engineer (mainly engaged in system design)"
"","","","","103","Information processing project manager","103-01","Information processing project manager","Project manager (application software development), project manager (system development)"
"","","","","104","Software development engineer","104-01","Software development engineer (WEB / open system)","WEB software development engineer, open software development engineer, content development engineer (mobile site)"
"","","","","","","104-02","Software development engineer (embedded / control system)","Embedded software development engineer, control software development engineer"
"","","","","","","104-03","Software development engineer (general-purpose machine)","General-purpose machine software development engineer"
"","","","","","","104-04","programmer","Coder, software programmer"
"","","","","","","104-99","Software development engineer not classified elsewhere","Software test engineer"
"","","","","105","System operation administrator","105-01","System operation administrator","Server administrator, system administrator, in-house system engineer (mainly engaged in system operation), information security engineer, database administrator, technical support engineer"
"","","","","106","Communication network technician","106-01","Communication network technician","Telecommunications engineers, telecommunications facility engineers, network engineers"
"","","","","109","Other information processing / communication engineers","109-99","Other information processing / communication engineers",""
"","","11","Other technicians","119","Other technicians","119-01","Occupational safety and health technician","Working environment measurer, occupational safety consultant"
"","","","","","","119-02","Environmental hygiene technician","Sewage treatment engineer, manure treatment facility engineer, waste treatment facility technical manager, water treatment facility management engineer"
"","","","","","","119-99","Technicians not classified elsewhere","Space development engineer, geological survey engineer, boiler inspector, high pressure gas equipment safety inspector"
"","","12","Doctors, dentists, veterinarians, pharmacists","121","Doctor","121-01","Doctor","Surgeon, obstetrician and gynecologist, psychiatrist, pediatrician, physician"
"","","","","122","Dentist","122-01","Dentist",""
"","","","","123","Veterinarian","123-01","Veterinarian","Livestock Clinic Veterinarian, Small Animal Clinical Veterinarian, Veterinary Hospital Veterinarian, Livestock Inspector"
"","","","","124","pharmacist","124-01","Pharmacist (dispensing)","Dispensing pharmacy Pharmacist, pharmacist (hospital dispensing office)"
"","","","","","","124-02","Pharmacist (pharmaceutical sales)","Pharmaceutical salesperson (pharmacist)"
"","","","","","","124-99","Unclassified pharmacist","Drug management pharmacist (pharmaceutical wholesale business), clinical trial coordinator (CRC: pharmacist)"
"","","13","Public health nurses, midwives, nurses","131","Public health nurse","131-01","Public health nurse","Chief of Health"
"","","","","132","Midwife","132-01","Midwife","Midwife"
"","","","","133","Nurse, associate nurse","133-01","nurse","Chief nurse, clinical trial coordinator (CRC: what is a nurse), visiting nurse"
"","","","","","","133-02","Associate nurse",""
"","","14","Medical technician","141","Radiological technologist","141-01","Radiological technologist","Radiological X-ray technician, X-ray technician (medical), radiologist (medical)"
"","","","","142","Clinical engineer","142-01","Clinical engineer","Clinical engineer"
"","","","","143","Clinical laboratory technician","143-01","Clinical laboratory technician","Public health laboratory technologist, electrocardiogram inspector, ultrasonic inspector (clinical examination)"
"","","","","144","physical therapist","144-01","physical therapist","PT (Physiotherapist)"
"","","","","145","Occupational therapist","145-01","Occupational therapist","OT (Occupational Therapist)"
"","","","","146","Orthoptist, speech therapist","146-01","Orthoptist","ORT (Orthoptist)"
"","","","","","","146-02","Speech therapist","ST (speech-language therapist)"
"","","","","147","Dental hygienist","147-01","Dental hygienist",""
"","","","","148","Dental technician","148-01","Dental technician",""
"","","15","Other health professions","151","Dietitian, registered dietitian","151-01","Nutritionist","School nutritionist, hospital nutritionist, welfare facility nutritionist"
"","","","","","","151-02","Registered dietitian","Registered dietitian"
"","","","","152","Anma Massage Shiatsushi, Acupuncture, Moxibutionist","152-01","Anma Massage Shiatsushi","Anma, Anma masseuse, Shiatsu, masseuse"
"","","","","","","152-02","Acupuncturist","Acupuncturist"
"","","","","","","152-03","Moxibutionist","Moxibustionist"
"","","","","153","Judo rehabilitation teacher","153-01","Judo rehabilitation teacher","Osteopath, osteopath"
"","","","","159","Healthcare profession not classified elsewhere","159-01","Prosthetist","Prosthetist"
"","","","","","","159-99","Other health care professions not classified elsewhere",""
"","","16","Professional profession of social welfare","161","Welfare counseling / guidance specialist","161-01","Welfare counselor","Home counselor, caseworker (rehabilitation counseling center for persons with disabilities), child welfare officer, welfare officer for persons with disabilities, counselor (child guidance center), counselor (women's counseling center), mother and child independence supporter, interviewer (welfare office) )"
"","","","","","","161-99","Welfare counseling and guidance specialists not classified elsewhere","Inspection instructor, child psychology officer, psychological judge, welfare office caseworker, welfare office district staff"
"","","","","162","Welfare facility guidance specialist","162-01","Elderly welfare facility guidance specialist","Functional training instructor (welfare facility for the elderly), life instructor (welfare facility for the elderly), life counselor (welfare facility for the elderly)"
"","","","","","","162-02","Welfare facility guidance specialist for persons with disabilities","Work instructor, vocational instructor, job judge, employment supporter (disabled person facility), life supporter (disabled person facility)"
"","","","","","","162-03","Child welfare facility guidance specialist","Child instructor (child care facility), child independence support specialist, child life supporter, boy instructor, mother and child instructor"
"","","","","163","Childminder","163-01","Childminder","Childminder"
"","","","","169","Other social welfare professionals","169-01","Nursing care specialist","Care manager"
"","","","","","","169-02","Medical social worker","Medical Social Worker (MSW), Psychiatric Social Worker (PSW), Psychiatric Social Worker, Hospital Caseworker"
"","","","","","","169-99","Professional welfare profession not classified elsewhere","Psychological counselor (social welfare facility), school social worker, counselor (social welfare council), counselor (community comprehensive support center), welfare equipment specialist counselor"
"","","17","Legal profession","171","judge","171-01","judge","Judge"
"","","","","172","Prosecutor","172-01","Prosecutor",""
"","","","","173","lawyer","173-01","lawyer","lawyer"
"","","","","174","patent attorney","174-01","patent attorney","patent attorney"
"","","","","175","Judicial scrivener","175-01","Judicial scrivener","Judicial scrivener"
"","","","","179","Other legal professions","179-01","Land and house survey",""
"","","","","","","179-99","Legal profession not classified elsewhere","Maritime Tribunal Judge, Notary, Court Clerk, Court Investigator, JPO Judge"
"","","18","Professional occupation of management / finance / insurance","181","Certified public accountant","181-01","Certified public accountant","Assistant accountant"
"","","","","182","Tax accountant","182-01","Tax accountant",""
"","","","","183","Social insurance labor consultant","183-01","Social insurance labor consultant","Social insurance labor consultant"
